text,valence_score
ἤδη γάρ με καὶ ἄλλοτ' ἀλεξέμεναι μεμαῶτα   ,0.125
ἀλλὰ σὺ μὲν νῦν αὖτις ἀπόστιχε μή τι νοήσῃ,-0.625
Ἤτοι ὅ γ’ ὣς εἰπὼν κατ’ ἄρ’ ἕζετο· τοῖσι δ’ ἀνέστη,0.0
"Μυρμιδόνων δ' ἐπί τε κλισίας καὶ νῆας ἱκέσθην,",-0.25
"νῦν δ' εἶμι Φθίην δ', ἐπεὶ ἦ πολὺ φέρτερόν ἐστιν",0.5
αὐτὰρ ὃ ἔγνω ᾗσιν ἐνὶ φρεσὶ φώνησέν τε·,0.0
οὐ μὲν σοί ποτε ἶσον ἔχω γέρας ὁππότ' Ἀχαιοὶ,-0.375
"βῆσε θεῷ, ἀνὰ δὲ Χρυσηΐδα καλλιπάρῃον   ",0.75
"ἕλκετο δ' ἐκ κολεοῖο μέγα ξίφος, ἦλθε δ' Ἀθήνη",0.0
"δεῦρο μαχησόμενος, ἐπεὶ οὔ τί μοι αἴτιοί εἰσιν·",0.625
ὃ σφῶϊ προΐει Βρισηΐδος εἵνεκα κούρης.,0.5
δῶκε δ' ἄγειν· τὼ δ' αὖτις ἴτην παρὰ νῆας Ἀχαιῶν·,-0.25
"καί ῥα πάροιθ' αὐτοῖο καθέζετο, καὶ λάβε γούνων   ",0.125
"τοῖς ἄλλοις· ἦ γὰρ ὅ γ' ὀλοιῇσι φρεσὶ θύει,",-0.5
"πίμπλαντ', ὄσσε δέ οἱ πυρὶ λαμπετόωντι ἐΐκτην·",-1.0
"ὃν Βριάρεων καλέουσι θεοί, ἄνδρες δέ τε πάντες",0.375
μῆνιν Ἀπόλλωνος ἑκατηβελέταο ἄνακτος·,0.125
"καρπαλίμως, τὴν δ' εἰς ὅρμον προέρεσσαν ἐρετμοῖς.",0.0
χραισμεῖν· ἀργαλέος γὰρ Ὀλύμπιος ἀντιφέρεσθαι·,0.25
λεύσσετε γὰρ τό γε πάντες ὅ μοι γέρας ἔρχεται ἄλλῃ.   ,-0.625
ὁππότε μιν ξυνδῆσαι Ὀλύμπιοι ἤθελον ἄλλοι,-0.125
"μήνι' Ἀχαιοῖσιν, πολέμου δ' ἀποπαύεο πάμπαν·",-0.375
"παιδὸς ἑοῦ, ἀλλ' ἥ γ' ἀνεδύσετο κῦμα θαλάσσης.",0.25
οὐρανόθεν· πρὸ δέ μ' ἧκε θεὰ λευκώλενος Ἥρη,1.0
"οὔτέ ποτ' ἐς πόλεμον, ἀλλὰ φθινύθεσκε φίλον κῆρ",-0.625
"ἐξαύδα, μὴ κεῦθε νόῳ, ἵνα εἴδομεν ἄμφω.",-0.25
πολλὰ δὲ μητρὶ φίλῃ ἠρήσατο χεῖρας ὀρεγνύς·,-0.5
νῦν δ' ἅμα τ' ὠκύμορος καὶ ὀϊζυρὸς περὶ πάντων,-1.0
Λητοῦς καὶ Διὸς υἱός· ὃ γὰρ βασιλῆι χολωθεὶς,0.125
τὴν μὲν γὰρ σὺν νηῒ θοῇ ἑλίκωπες Ἀχαιοὶ,-0.125
"Κλῦθί μευ, Ἀργυρότοξ’, ὃς Χρύσην ἀμφιβέβηκας",0.5
"Ἀλλ' ἤτοι μὲν ταῦτα μεταφρασόμεσθα καὶ αὖτις,   ",-0.25
"Ὦ πόποι, ἦ μέγα πένθος Ἀχαιΐδα γαῖαν ἱκάνει·",-0.5
Ὣς τώ γ' ἀντιβίοισι μαχεσσαμένω ἐπέεσσιν,0.0
μή τι σὺ ταῦτα ἕκαστα διείρεο μηδὲ μετάλλα.   ,0.0
"ἂψ ἀπονοστήσειν, εἴ κεν θάνατόν γε φύγοιμεν,   ",0.125
"οὐκ ἔθελον δέξασθαι, ἐπεὶ πολὺ βούλομαι αὐτὴν",0.0
Τὴν δὲ βαρὺ στενάχων προσέφη πόδας ὠκὺς Ἀχιλλεύς·,0.0
εἶμ' αὐτὴ πρὸς Ὄλυμπον ἀγάννιφον αἴ κε πίθηται.   ,-0.25
Οἶσθα· τί ἤ τοι ταῦτα ἰδυίῃ πάντ' ἀγορεύω;,-0.375
οἷον Πειρίθοόν τε Δρύαντά τε ποιμένα λαῶν,0.75
ἠτίμησεν· ἑλὼν γὰρ ἔχει γέρας αὐτὸς ἀπούρας.,-0.5
χερσὶ μὲν οὔ τοι ἔγωγε μαχήσομαι εἵνεκα κούρης,0.75
ἢ ὁδὸν ἐλθέμεναι ἢ ἀνδράσιν ἶφι μάχεσθαι;,0.125
κάρτιστοι μὲν ἔσαν καὶ καρτίστοις ἐμάχοντο,0.875
ἀμβρόσιαι δ' ἄρα χαῖται ἐπεῤῥώσαντο ἄνακτος,0.125
αἰεί τοι φίλον ἐστὶν ἐμεῦ ἀπὸ νόσφιν ἐόντα,-0.5
"Σμινθεῦ, εἴ ποτέ τοι χαρίεντ’ ἐπὶ νηὸν ἔρεψα,",0.375
"ῥέξαι ὑπὲρ Δαναῶν ὄφρ' ἱλασόμεσθα ἄνακτα,",0.75
"Ἀτρεΐδης δ' ἄρα νῆα θοὴν ἅλα δὲ προέρυσσεν,",0.5
"θάμβησεν δ' Ἀχιλεύς, μετὰ δ' ἐτράπετ', αὐτίκα δ' ἔγνω",0.375
τοῖσιν δ' ἴκμενον οὖρον ἵει ἑκάεργος Ἀπόλλων·,0.875
"ᾠχόμεθ' ἐς Θήβην ἱερὴν πόλιν Ἠετίωνος,",0.0
ὄφρ' ἥμιν ἑκάεργον ἱλάσσεαι ἱερὰ ῥέξας.,-0.25
"Ἦ δὴ λοίγια ἔργα τάδ' ἔσσεται οὐδ' ἔτ' ἀνεκτά,",-0.375
πρόφρων τέτληκας εἰπεῖν ἔπος ὅττι νοήσῃς.,-0.375
Τὸν δ' ἄρ' ὑπόδρα ἰδὼν προσέφη πόδας ὠκὺς Ἀχιλλεύς·,-0.125
"ἱστία μὲν στείλαντο, θέσαν δ' ἐν νηῒ μελαίνῃ,",-0.25
"δακρύσας ἑτάρων ἄφαρ ἕζετο νόσφι λιασθείς,",-0.625
"Ὣς εἰπὼν προΐει, κρατερὸν δ' ἐπὶ μῦθον ἔτελλε·",0.0
Αἰγαίων' — ὃ γὰρ αὖτε βίην οὗ πατρὸς ἀμείνων —,0.25
οὐδέ τί που ἴδμεν ξυνήϊα κείμενα πολλά·,0.25
"ἢ ἀπόειπ', ἐπεὶ οὔ τοι ἔπι δέος, ὄφρ' ἐῢ εἰδῶ",-0.25
οὐδ’ ὅ γε πρὶν Δαναοῖσιν ἀεικέα λοιγὸν ἀπώσει,-0.375
"βήσομεν· εἷς δέ τις ἀρχὸς ἀνὴρ βουληφόρος ἔστω,",-0.25
ἦ ποτ' Ἀχιλλῆος ποθὴ ἵξεται υἷας Ἀχαιῶν   ,0.375
μέλποντες ἑκάεργον· ὃ δὲ φρένα τέρπετ' ἀκούων.,0.875
πρίν γ’ ἀπὸ πατρὶ φίλῳ δόμεναι ἑλικώπιδα κούρην,0.0
"λυσόμενός τε θύγατρα φέρων τ' ἀπερείσι' ἄποινα,",-0.125
ἐλθὼν σὺν πλεόνεσσι· τό οἱ καὶ ῥίγιον ἔσται.,-1.0
"εἰ δὲ σὺ καρτερός ἐσσι θεὰ δέ σε γείνατο μήτηρ,   ",0.75
εἰ δὴ σοὶ πᾶν ἔργον ὑπείξομαι ὅττί κεν εἴπῃς·,0.0
ἔνθά με Σίντιες ἄνδρες ἄφαρ κομίσαντο πεσόντα.,0.5
πῶς γάρ τοι δώσουσι γέρας μεγάθυμοι Ἀχαιοί;,0.125
"πέμψω, ἐγὼ δέ κ' ἄγω Βρισηΐδα καλλιπάρῃον",-0.25
ἦ ἵνα ὕβριν ἴδῃ Ἀγαμέμνονος Ἀτρεΐδαο;,-0.25
εἰ δέ κε μὴ δώῃσιν ἐγὼ δέ κεν αὐτὸς ἕλωμαι,-1.0
Ἀτρεΐδης δ' ἑτέρωθεν ἐμήνιε· τοῖσι δὲ Νέστωρ,-0.25
εὗρεν δ' εὐρύοπα Κρονίδην ἄτερ ἥμενον ἄλλων,0.125
Ἥρη· ἐμοὶ δέ κε ταῦτα μελήσεται ὄφρα τελέσσω·,0.375
ὣς ὃ μὲν ἔνθα καθέζετ' ἐπὶ θρόνου· οὐδέ μιν Ἥρη,-0.125
Ζεὺς γὰρ ἐς Ὠκεανὸν μετ' ἀμύμονας Αἰθιοπῆας,-0.25
Τίς δ' αὖ τοι δολομῆτα θεῶν συμφράσσατο βουλάς;   ,-0.25
"ἀλλὰ σὺ τόν γ' ἐλθοῦσα θεὰ ὑπελύσαο δεσμῶν,",0.75
λαοὺς δ' οὐκ ἐπέοικε παλίλλογα ταῦτ' ἐπαγείρειν.,0.375
ἐκ δὲ Χρυσηῒς νηὸς βῆ ποντοπόροιο.,0.0
"καὶ τότ' ἔπειτά τοι εἶμι Διὸς ποτὶ χαλκοβατὲς δῶ,",-0.25
"Ἀτρεΐδην προσέειπε, καὶ οὔ πω λῆγε χόλοιο·",-0.375
"οὐδέ τι οἶδε νοῆσαι ἅμα πρόσσω καὶ ὀπίσσω,",-0.5
τῇ δεκάτῃ δ' ἀγορὴν δὲ καλέσσατο λαὸν Ἀχιλλεύς·,0.625
"ἂψ δ' ἐς κουλεὸν ὦσε μέγα ξίφος, οὐδ' ἀπίθησε   ",0.375
Τὸν δ' ἀπαμειβόμενος προσέφη κρείων Ἀγαμέμνων·   ,0.125
ἀλλὰ μάλ' εὔκηλος τὰ φράζεαι ἅσσ' ἐθέλῃσθα.,0.25
τὸν καὶ ὑπέδεισαν μάκαρες θεοὶ οὐδ' ἔτ' ἔδησαν.,0.125
ἠερίη δ' ἀνέβη μέγαν οὐρανὸν Οὔλυμπόν τε.,0.25
ἀργυρόπεζα Θέτις θυγάτηρ ἁλίοιο γέροντος·,0.0
"αἴ κέν πως ἐθέλῃσιν ἐπὶ Τρώεσσιν ἀρῆξαι,",-0.125
τοῦτο γὰρ ἐξ ἐμέθεν γε μετ' ἀθανάτοισι μέγιστον,0.375
αἴθ' ὄφελες παρὰ νηυσὶν ἀδάκρυτος καὶ ἀπήμων,-0.75
"Ἀτρεΐωνα δ' ἔπειτα χόλος λάβεν, αἶψα δ' ἀναστὰς",-0.5
"πᾶν δ' ἦμαρ φερόμην, ἅμα δ' ἠελίῳ καταδύντι",-0.375
"ἄλλοισιν δὴ ταῦτ' ἐπιτέλλεο, μὴ γὰρ ἔμοιγε",0.125
φηρσὶν ὀρεσκῴοισι καὶ ἐκπάγλως ἀπόλεσσαν.,0.875
εἴ περ γάρ κ' ἐθέλῃσιν Ὀλύμπιος ἀστεροπητὴς   ,0.25
Τὴν δ' ἀπαμειβόμενος προσέφη νεφεληγερέτα Ζεύς·   ,-0.125
οἴκοι ἔχειν· καὶ γάρ ῥα Κλυταιμνήστρης προβέβουλα,-0.5
"Μυρμιδόνεσσιν ἄνασσε, σέθεν δ' ἐγὼ οὐκ ἀλεγίζω,   ",-0.375
ἱστὸν δ' ἱστοδόκῃ πέλασαν προτόνοισιν ὑφέντες,0.0
ἀλλ' ἀκέων δὴν ἧστο· Θέτις δ' ὡς ἥψατο γούνων,-0.25
"αὐτὰρ ἐπεὶ κατὰ μῆρε κάη καὶ σπλάγχνα πάσαντο,",0.75
"χρυσέῳ ἀνὰ σκήπτρῳ, καὶ λίσσετο πάντας Ἀχαιούς,",-0.375
ἕρδον δ' Ἀπόλλωνι τεληέσσας ἑκατόμβας,-0.25
οὐ γὰρ ἐγὼ Τρώων ἕνεκ' ἤλυθον αἰχμητάων,0.375
ἔπλετ'· ἀτάρ μιν νῦν γε ἄναξ ἀνδρῶν Ἀγαμέμνων,-0.25
"ναὶ μὰ τόδε σκῆπτρον, τὸ μὲν οὔ ποτε φύλλα καὶ ὄζους",0.0
ἤϊε σύν τε Μενοιτιάδῃ καὶ οἷς ἑτάροισιν·,0.375
τὴν μὲν ἔπειτ' ἐπὶ βωμὸν ἄγων πολύμητις Ὀδυσσεὺς   ,0.25
ἀλλὰ τὸ μὲν πλεῖον πολυάϊκος πολέμοιο,-0.125
Ὣς οἳ μὲν τὰ πένοντο κατὰ στρατόν· οὐδ' Ἀγαμέμνων,0.0
εἰ δέ κε μὴ δώωσιν ἐγὼ δέ κεν αὐτὸς ἕλωμαι,-0.875
γνῷ δὲ καὶ Ἀτρεΐδης εὐρὺ κρείων Ἀγαμέμνων,-0.125
οἴῳ φαινομένη· τῶν δ' ἄλλων οὔ τις ὁρᾶτο·,0.375
ἣ δὲ καὶ αὔτως μ' αἰεὶ ἐν ἀθανάτοισι θεοῖσι   ,-0.75
ἀλλὰ πίθεσθ'· ἄμφω δὲ νεωτέρω ἐστὸν ἐμεῖο·,0.5
ἀλλ' ἔκ τοι ἐρέω καὶ ἐπὶ μέγαν ὅρκον ὀμοῦμαι·,0.125
ἀλλὰ καὶ ὧς ἐθέλω δόμεναι πάλιν εἰ τό γ' ἄμεινον·,-0.375
Τὸν δ' ἠμείβετ' ἔπειτα ποδάρκης δῖος Ἀχιλλεύς·,0.0
διογενὴς Πηλῆος υἱὸς πόδας ὠκὺς Ἀχιλλεύς·,-0.375
αἰδεῖσθαί θ' ἱερῆα καὶ ἀγλαὰ δέχθαι ἄποινα·,-0.125
εὖ εἰδὼς ἀγόρευε θεοπροπίας Ἑκάτοιο.,-0.25
"Οἰνοβαρές, κυνὸς ὄμματ' ἔχων, κραδίην δ' ἐλάφοιο,",-0.5
"νεικείῃσι πατήρ, σὺν δ' ἡμῖν δαῖτα ταράξῃ.",0.25
νώμησαν δ' ἄρα πᾶσιν ἐπαρξάμενοι δεπάεσσιν·,0.875
ἣ δ' ἀέκουσ' ἅμα τοῖσι γυνὴ κίεν· αὐτὰρ Ἀχιλλεὺς,-0.625
"τριπλῇ τετραπλῇ τ' ἀποτείσομεν, αἴ κέ ποθι Ζεὺς",0.75
"δαίνυντ', οὐδέ τι θυμὸς ἐδεύετο δαιτὸς ἐΐσης,",0.625
"Ὣς εἰπὼν ἐν χερσὶ τίθει, ὃ δὲ δέξατο χαίρων",0.75
Ναὶ δὴ ταῦτά γε πάντα γέρον κατὰ μοῖραν ἔειπες·,0.375
εἰ δ' οὕτω τοῦτ' ἐστὶν ἐμοὶ μέλλει φίλον εἶναι·,-0.25
"βῆ δὲ κατ’ Οὐλύμποιο καρήνων χωόμενος κῆρ,",0.0
ἐσθλὸν δ' οὔτέ τί πω εἶπας ἔπος οὔτ' ἐτέλεσσας·,-1.0
Τὴν δὲ μέγ' ὀχθήσας προσέφη νεφεληγερέτα Ζεύς·,0.0
Ὣς τότε μὲν πρόπαν ἦμαρ ἐς ἠέλιον καταδύντα,0.0
"ἧσθαι δευόμενον, κέλεαι δέ με τῆνδ' ἀποδοῦναι;",-0.875
πατρὶ φίλῳ ἐν χερσὶ τίθει καί μιν προσέειπεν·,0.625
υἱὸν ἐμὸν τίσωσιν ὀφέλλωσίν τέ ἑ τιμῇ.   ,-0.25
τόξ’ ὤμοισιν ἔχων ἀμφηρεφέα τε φαρέτρην·,0.25
"οἴκαδ' ἴμεν σὺν νηυσὶ κορωνίσιν, οὐδέ σ' ὀΐω   ",0.75
αἴ κέν πως ἀρνῶν κνίσης αἰγῶν τε τελείων,0.25
ἕρκος Ἀχαιοῖσιν πέλεται πολέμοιο κακοῖο.,0.875
"οὐ μὰ γὰρ Ἀπόλλωνα Διῒ φίλον, ᾧ τε σὺ, Κάλχαν,",0.375
θνήσκοντες πίπτωσι· σὺ δ' ἔνδοθι θυμὸν ἀμύξεις,-0.375
ἶσον ἐμοὶ φάσθαι καὶ ὁμοιωθήμεναι ἄντην.,-1.0
"τὼ δ' ἀέκοντε βάτην παρὰ θῖν' ἁλὸς ἀτρυγέτοιο,",0.0
πρὸς Τρώων· τῶν οὔ τι μετατρέπῃ οὐδ' ἀλεγίζεις·   ,-0.375
"λυσόμενός τε θύγατρα φέρων τ’ ἀπερείσι’ ἄποινα,",0.125
"Ἀπόλλωνι ἄνακτι, τὸν ἠύκομος τέκε Λητώ·",0.125
τὴν δ’ ἐγὼ οὐ λύσω· πρίν μιν καὶ γῆρας ἔπεισιν,-1.0
ἐνθάδ' ἄτιμος ἐὼν ἄφενος καὶ πλοῦτον ἀφύξειν.,0.375
"θείομεν, ἂν δ' αὐτὴν Χρυσηΐδα καλλιπάρῃον",0.0
φύλλά τε καὶ φλοιόν· νῦν αὖτέ μιν υἷες Ἀχαιῶν,0.125
καὶ τότ' ἔπειτ' ἀνάγοντο μετὰ στρατὸν εὐρὺν Ἀχαιῶν·,0.375
ἐξ ἑδέων στυφελίξαι· ὃ γὰρ πολὺ φέρτατός ἐστιν.,0.0
δώματ' ἐς αἰγιόχοιο Διὸς μετὰ δαίμονας ἄλλους.,0.125
νῦν δ' αἰνῶς δείδοικα κατὰ φρένα μή σε παρείπῃ,-0.5
"τοὔνεκ’ ἄρ’ ἄλγε’ ἔδωκεν ἑκηβόλος ἠδ’ ἔτι δώσει,",-0.25
βάλλ’· αἰεὶ δὲ πυραὶ νεκύων καίοντο θαμειαί.,-0.5
σύμπαντας· τότε δ' οὔ τι δυνήσεαι ἀχνύμενός περ,-0.25
Ἥρῃ ὅτ' ἄν μ' ἐρέθῃσιν ὀνειδείοις ἐπέεσσιν·,-0.75
"Μῆτερ ἐπεί μ' ἔτεκές γε μινυνθάδιόν περ ἐόντα,",-0.5
οὐδ' ἀτελεύτητον ὅ τί κεν κεφαλῇ κατανεύσω.,0.25
οἴκαδ' ἰὼν σὺν νηυσί τε σῇς καὶ σοῖς ἑτάροισι,0.0
"δίπτυχα ποιήσαντες, ἐπ' αὐτῶν δ' ὠμοθέτησαν·",0.125
ἠγνοίησεν ἰδοῦσ' ὅτι οἱ συμφράσσατο βουλὰς,-0.125
τίσειαν Δαναοὶ ἐμὰ δάκρυα σοῖσι βέλεσσιν.,0.0
"ἀλλ' ἀκέουσα κάθησο, ἐμῷ δ' ἐπιπείθεο μύθῳ,",-0.5
Ζεὺς δὲ ἑὸν πρὸς δῶμα· θεοὶ δ' ἅμα πάντες ἀνέσταν,0.625
"Ἧλθον ἐγὼ παύσουσα τὸ σὸν μένος, αἴ κε πίθηαι,",0.75
ἀλλὰ σὺ εἰ δύνασαί γε περίσχεο παιδὸς ἑῆος·,0.125
"λίσσομ' Ἀχιλλῆϊ μεθέμεν χόλον, ὃς μέγα πᾶσιν",0.75
"καρπαλίμως δ' ἀνέδυ πολιῆς ἁλὸς ἠΰτ' ὀμίχλη,",0.25
"οἴη ἐν ἀθανάτοισιν ἀεικέα λοιγὸν ἀμῦναι,",0.375
ἦ κεν γηθήσαι Πρίαμος Πριάμοιό τε παῖδες,0.25
ὅς κε θεοῖς ἐπιπείθηται μάλα τ' ἔκλυον αὐτοῦ.,0.75
οἰωνοῖσί τε πᾶσι· Διὸς δ’ ἐτελείετο βουλή·,-0.25
"εἰ σφῶϊν τάδε πάντα πυθοίατο μαρναμένοιϊν,",-0.25
"εἰ δὴ σφὼ ἕνεκα θνητῶν ἐριδαίνετον ὧδε,",-0.5
Τὴν δ' ἠμείβετ' ἔπειτα πατὴρ ἀνδρῶν τε θεῶν τε·,0.0
ἐς Χρύσην ἵκανεν ἄγων ἱερὴν ἑκατόμβην.,0.125
Ἤτοι ὅ γ' ὣς εἰπὼν κατ' ἄρ' ἕζετο· τοῖσι δ' ἀνέστη,0.0
οὔτε λόχον δ' ἰέναι σὺν ἀριστήεσσιν Ἀχαιῶν,-0.375
χερνίψαντο δ' ἔπειτα καὶ οὐλοχύτας ἀνέλοντο.,0.625
τῇ σ' ὀΐω κατανεῦσαι ἐτήτυμον ὡς Ἀχιλῆα,-0.25
αὐτίκ' ἔπειθ' ἵλαος Ὀλύμπιος ἔσσεται ἡμῖν.,0.875
"ὕβριος εἵνεκα τῆσδε· σὺ δ' ἴσχεο, πείθεο δ' ἡμῖν.",1.0
"καί ῥα πάροιθ' αὐτοῖο καθέζετο δάκρυ χέοντος,   ",0.25
Τὸν δ' ἠμείβετ' ἔπειτα ἄναξ ἀνδρῶν Ἀγαμέμνων·,0.0
"ἀπριάτην ἀνάποινον, ἄγειν θ’ ἱερὴν ἑκατόμβην",0.25
Ἦ γάρ κεν δειλός τε καὶ οὐτιδανὸς καλεοίμην,-0.375
Χρὴ μὲν σφωΐτερόν γε θεὰ ἔπος εἰρύσσασθαι,0.0
"ἀλλ’ ἄγε δή τινα μάντιν ἐρείομεν ἢ ἱερῆα,",0.5
τῶν νῦν μιν μνήσασα παρέζεο καὶ λαβὲ γούνων,0.25
"Ζεῦ πάτερ, εἴ ποτε δή σε μετ' ἀθανάτοισιν ὄνησα",0.375
"ἕζετ’ ἔπειτ’ ἀπάνευθε νεῶν, μετὰ δ’ ἰὸν ἕηκε·",0.0
Ὣς ἔφατ’· ἔδεισεν δ’ ὁ γέρων καὶ ἐπείθετο μύθῳ·,0.0
καί μιν φωνήσας ἔπεα πτερόεντα προσηύδα·,-0.375
ἀλλ' εἰ μὲν δώσουσι γέρας μεγάθυμοι Ἀχαιοὶ,-0.375
μή νύ τοι οὐ χραίσμῃ σκῆπτρον καὶ στέμμα θεοῖο·,-1.0
"μεῖναι ἐπερχόμενον, ἀλλ' ἀντίοι ἔσταν ἅπαντες.",0.375
δημοβόρος βασιλεὺς ἐπεὶ οὐτιδανοῖσιν ἀνάσσεις·,-0.375
οὔτέ ποτ' εἰς ἀγορὴν πωλέσκετο κυδιάνειραν   ,-0.375
"ἀλλὰ κακῶς ἀφίει, κρατερὸν δ' ἐπὶ μῦθον ἔτελλε·",-0.625
"πᾶσι δὲ σημαίνειν, ἅ τιν' οὐ πείσεσθαι ὀΐω·",-0.625
τοῦτο δέ τοι ἐρέουσα ἔπος Διὶ τερπικεραύνῳ,-0.5
κούρην Βρισῆος τήν μοι δόσαν υἷες Ἀχαιῶν.,-0.625
ἀκροτάτῃ κορυφῇ πολυδειράδος Οὐλύμποιο·,0.25
ἄξω ἑλών· ὃ δέ κεν κεχολώσεται ὅν κεν ἵκωμαι.,-0.875
"ἢ καὶ ὀνειροπόλον, καὶ γάρ τ’ ὄναρ ἐκ Διός ἐστιν,",0.25
οἳ δὲ πανημέριοι μολπῇ θεὸν ἱλάσκοντο,0.875
δῷσι πόλιν Τροίην εὐτείχεον ἐξαλαπάξαι.,0.875
"Ὣς φάτο, μείδησεν δὲ θεὰ λευκώλενος Ἥρη,",0.0
"νεικεῖ, καί τέ μέ φησι μάχῃ Τρώεσσιν ἀρήγειν.",-0.75
"εἴ ταρ ὅ γ’ εὐχωλῆς ἐπιμέμφεται ἠδ’ ἑκατόμβης,",-0.25
"χρυσέῳ ἀνὰ σκήπτρῳ, καὶ λίσσετο πάντας Ἀχαιούς,",0.25
οὔρεά τε σκιόεντα θάλασσά τε ἠχήεσσα·,0.0
"ταύρων ἠδ’ αἰγῶν, τὸδε μοι κρήηνον ἐέλδωρ·",0.125
"Ἀλλ' ὅτε δή ῥ' ἐκ τοῖο δυωδεκάτη γένετ' ἠώς,",0.0
χωόμενος δ' ὁ γέρων πάλιν ᾤχετο· τοῖο δ' Ἀπόλλων   ,-0.625
"Ὣς φάτο· Πηλεΐωνι δ' ἄχος γένετ', ἐν δέ οἱ ἦτορ",0.0
καὶ μάλα περ θυμῷ κεχολωμένον· ὧς γὰρ ἄμεινον·,0.25
"Ἐννῆμαρ μὲν ἀνὰ στρατὸν ᾤχετο κῆλα θεοῖο,",0.0
καί σφωϊν δὸς ἄγειν· τὼ δ' αὐτὼ μάρτυροι ἔστων,-0.375
σήμαιν'· οὐ γὰρ ἔγωγ' ἔτι σοὶ πείσεσθαι ὀΐω.,0.125
"ἐν Πύλῳ ἠγαθέῃ, μετὰ δὲ τριτάτοισιν ἄνασσεν·",0.25
"καῖε δ' ἐπὶ σχίζῃς ὁ γέρων, ἐπὶ δ' αἴθοπα οἶνον",0.375
ἤδη νῦν Δαναοῖσιν ἀεικέα λοιγὸν ἄμυνον.,1.0
"Ζεὺς δὲ πρὸς ὃν λέχος ἤϊ' Ὀλύμπιος ἀστεροπητής,",0.75
τηλόθεν ἐξ ἀπίης γαίης· καλέσαντο γὰρ αὐτοί·   ,0.25
Τίπτ' αὖτ' αἰγιόχοιο Διὸς τέκος εἰλήλουθας;,0.25
"ᾧ ἔπι πολλὰ μόγησα, δόσαν δέ μοι υἷες Ἀχαιῶν.",0.125
"ὦχ' ἑκατόγχειρον καλέσασ' ἐς μακρὸν Ὄλυμπον,",0.375
"ἦμος δ' ἠριγένεια φάνη ῥοδοδάκτυλος Ἠώς,",0.75
Μάντι κακῶν οὐ πώ ποτέ μοι τὸ κρήγυον εἶπας·,-1.0
"ἐς Χρύσην πέμπουσιν, ἄγουσι δὲ δῶρα ἄνακτι·   ",0.0
"οὐλομένην, ἣ μυρί’ Ἀχαιοῖς ἄλγε’ ἔθηκε,",-0.375
καί ῥ' ἀκέουσα καθῆστο ἐπιγνάμψασα φίλον κῆρ·,-0.5
"εἴ περ γάρ τε χόλον γε καὶ αὐτῆμαρ καταπέψῃ,",-0.25
Τὸν δ' αὖτε προσέειπε θεὰ γλαυκῶπις Ἀθήνη·,0.25
πολλὰ δ’ ἔπειτ’ ἀπάνευθε κιὼν ἠρᾶθ’ ὁ γεραιὸς,0.25
τόφρα δ' ἐπὶ Τρώεσσι τίθει κράτος ὄφρ' ἂν Ἀχαιοὶ,-0.25
"Ὣς ἄρα φωνήσασ' ἀπεβήσετο, τὸν δὲ λίπ' αὐτοῦ",-0.5
ἠδ' ἔτι καὶ νῦν μοι τόδ' ἐπικρήηνον ἐέλδωρ·,0.5
τὴν δὲ διεπράθομέν τε καὶ ἤγομεν ἐνθάδε πάντα·,-0.25
Καὶ τότε δὴ θάρσησε καὶ ηὔδα μάντις ἀμύμων·,0.0
καὶ πρὸς τοῦ βασιλῆος ἀπηνέος εἴ ποτε δ' αὖτε   ,-0.5
"ἐκ δ' ἄγαγε κλισίης Βρισηΐδα καλλιπάρῃον,",-0.375
"χραισμεῖν, εὖτ' ἂν πολλοὶ ὑφ' Ἕκτορος ἀνδροφόνοιο",-0.375
στέμματ' ἔχων ἐν χερσὶν ἑκηβόλου Ἀπόλλωνος,0.375
ταύρων ἠδ' αἰγῶν παρὰ θῖν' ἁλὸς ἀτρυγέτοιο·,-0.25
ἠπείλησεν μῦθον ὃ δὴ τετελεσμένος ἐστί·,-0.5
"ἀλλὰ πίθεσθε καὶ ὔμμες, ἐπεὶ πείθεσθαι ἄμεινον·",1.0
"σοὶ τὸ γέρας πολὺ μεῖζον, ἐγὼ δ' ὀλίγον τε φίλον τε",-0.25
"οἳ μὲν κακκείοντες ἔβαν οἶκον δὲ ἕκαστος,",0.5
νῆα μὲν οἵ γε μέλαιναν ἐπ' ἠπείροιο ἔρυσσαν,0.625
αὐτὰρ ὃ τοῖς ἄλλοισι θεοῖς ἐνδέξια πᾶσιν,0.5
τίμησόν μοι υἱὸν ὃς ὠκυμορώτατος ἄλλων,0.25
χωόμενος ὅ τ' ἄριστον Ἀχαιῶν οὐδὲν ἔτισας.,-0.375
"ἆσσον ἰόνθ', ὅτε κέν τοι ἀάπτους χεῖρας ἐφείω.",-0.5
μᾶλλον ἐμοὶ ἔσεαι· τὸ δέ τοι καὶ ῥίγιον ἔσται.,-0.5
ἢ ὅ γε φάσγανον ὀξὺ ἐρυσσάμενος παρὰ μηροῦ   ,-0.25
δὴ τότε κοιμήσαντο παρὰ πρυμνήσια νηός·,0.625
"Ὣς φάτο· τὴν δ' οὔ τι προσέφη νεφεληγερέτα Ζεύς,",0.0
"Ἀτρεΐδη, νῦν ἄμμε παλιμπλαγχθέντας ὀίω",0.875
"Ἦμος δ' ἠέλιος κατέδυ καὶ ἐπὶ κνέφας ἦλθε,",0.625
Δαιμονίη αἰεὶ μὲν ὀΐεαι οὐδέ σε λήθω·,-0.5
ὅ σφιν ἐὺ φρονέων ἀγορήσατο καὶ μετέειπεν·,0.75
Ἔνθ' ἄλλοι μὲν πάντες ἐπευφήμησαν Ἀχαιοὶ,0.375
